{
  "name": "matrix",
  "label": "Matrix",
  "colors": {
    "bg": "#000000",
    "window": "#0a0f0a",
    "windowAlt": "#050a05",
    "text": "#00ff41",
    "muted": "#008f11",
    "mutedAlt": "#005a0c",
    "border": "#003b00",
    "borderSoft": "#002800",
    "accent": "#00ff41",
    "accentSoft": "rgba(0,255,65,.12)",
    "hover": "rgba(0,255,65,.08)"
  },
  "fonts": {
    "mono": {
      "family": "'JetBrains Mono', monospace",
      "url": "https://fonts.googleapis.com/css2?family=JetBrains+Mono:wght@300;400;500;700&display=swap"
    }
  },
  "particles": {
    "enabled": true,
    "count": 100,
    "colors": ["#00ff41"],
    "linkColor": "#008f11",
    "linkOpacity": 0.15,
    "linkDistance": 120,
    "speed": 1.2,
    "size": 2
  },
  "glow": {
    "enabled": false
  }
}
