{
  "name": "midnight",
  "label": "Midnight",
  "colors": {
    "bg": "#05070a",
    "window": "#0d1117",
    "windowAlt": "#0b0f14",
    "text": "#f5f7fa",
    "muted": "#8b949e",
    "mutedAlt": "#5a6470",
    "border": "#1d2530",
    "borderSoft": "#161c25",
    "accent": "#6cb6ff",
    "accentSoft": "rgba(108,182,255,.12)",
    "hover": "rgba(108,182,255,.10)"
  },
  "fonts": {
    "mono": {
      "family": "'JetBrains Mono', monospace",
      "url": "https://fonts.googleapis.com/css2?family=JetBrains+Mono:wght@300;400;500;700&display=swap"
    }
  },
  "particles": {
    "enabled": true,
    "count": 70,
    "colors": ["#6cb6ff", "#8b949e", "#ffffff"],
    "linkColor": "#6cb6ff",
    "linkOpacity": 0.18,
    "linkDistance": 140,
    "speed": 0.6,
    "size": 2
  },
  "glow": {
    "enabled": true,
    "layers": [
      { "position": "top left",     "color": "rgba(108,182,255,.12)", "size": "35%" },
      { "position": "bottom right",  "color": "rgba(255,255,255,.05)",  "size": "45%" }
    ]
  }
}
